Frage,a,b,c,d,e
"56. Welche Ansichten zum „Selbstwertgefühl"" sind richtig?",A) Das Selbstwertgefühl ist das Ergebnis einer Selbstbewertung,B) Das Selbstwertgefühl ist unabhängig von der Wertschätzung anderer,C) Das Selbstwertgefühl ist eine Selbstbewertung in der Auseinandersetzung mit sich selbst und dem Umfeld,D) Das Selbstwertgefühl wird allein durch die Erziehung geprägt,.
57. In welchen Fällen wird Stress positiv empfunden?,A) Wenn er durch eine besonders schwierige Aufgabe ausgelöst wird,B) Wenn er durch Angst ausgelöst wird,C) Wenn er durch eine angestrebte Beförderung ausgelöst wird,D) Wenn er durch ein erfolgreiches Bewerbungsgespräch ausgelöst wird,.
58. Welche Aussage zur Sachebene ist richtig?,"A) Auf der Sachebene werden Fakten, z.B. über ein Verbot, einen Hinweis oder eine Warnung mitgeteilt","B) Auf der Sachebene wird verschlüsselt mitgeteilt, was der Sender vom Empfänger hält und wie er zu ihm steht","C) Auf der Sachebene soll der Empfänger veranlasst werden, etwas zu tun oder zu unterlassen",D) Auf der Sachebene verrät eine Person etwas über sich und ihre Persönlichkeit,.
59. Was zählt zur nonverbalen Kommunikation?,A) Das gesprochene Wort,B) Kopf- und Körperhaltung,C) Gestik und Mimik,D) Schriftliche Äußerungen,.
60. Wodurch kann falsches Verhalten von Wachpersonen gegenüber Menschen mit Behinderung ausgelöst werden?,A) Angst vor Unbekanntem und Fehlern,B) Angst vor Versprechern,C) Angst vor Ansteckung,D) Angst vor körperlicher Anstrengung,.
"61. Was ist im Umgang mit einer wütenden Person hilfreich, um deeskalierend zu wirken?",A) Die Situation auf der Beziehungsebene zu Ende bringen. Die Sachebene ist nicht hilfreich,B) Die andere Person zur Ruhe kommen lassen und Verständnis zeigen,"C) Wenn die Person beleidigend wird, laut werden und mit Folgen drohen",D) Selbstbeherrscht sein und mit Emotionen offen umgehen,.
62. Was ist aggressives Verhalten?,A) Einen andere Person beleidigen,B) Ein fremdes Fahrzeug beim Einparken fahrlässig beschädigen,C) Einen anderen absichtlich mit einem Faustschlag verletzen,"D) Einen Kollegen nicht beachten, z.B. nicht grüßen",.
63. Wie kann ein Vorgesetzter die Kommunikation unter seinen Mitarbeitern fördern?,A) Durch anlassbezogenen Erfahrungsaustausch,B) Durch Überwachung der Gespräche zwischen den Mitarbeitern,C) Durch die Einführung von regelmäßigen Mitarbeitergesprächen,D) Durch Übernahme der Führungsrolle in jedem Gespräch,.
64. Welche Verhaltensweisen sind oft bei Jugendlichen zu beobachten?,A) Sie bilden gerne Gruppen,B) Sie handeln oft spontan und unüberlegt,C) Sie sind nur selten für Neues zu begeistern,D) Sie handeln stets beherrscht und kontrolliert,.
65. Welche Aussagen zum Löschmittel Wasser sind richtig?,A) Wasser ist geeignet für die Brandklasse A,B) Wasser darf nicht bei brennenden Metallen benutzt werden,C) Wasser darf uneingeschränkt bei elektrischen Anlagen eingesetzt werden,D) Wasser löscht in der Hauptsache durch Ersticken,.
"66. Welche Melder sind für die „Fallenüberwachung"", bei der die Bewegung von Personen detektiert werden soll, geeignet?",A) Glasbruchmelder,B) Kapazitativer Feldveränderungsmelder,C) Infrarotmelder,D) Ultraschallmelder,.
67. Welche Bestandteile eines Gebäudes sind Schwerpunkte einer Außenhautkontrolle?,A) Fenster und Kellerschächte,B) Ein- und Ausfahrten,C) Zäune und Mauern,D) Ein- und Ausgangstüren,.
68. Für welche Art der Überwachung sind Körperschallmelder einsetzbar?,A) Zur Überwachung von Wertschutzräumen und Wertschutzschränken,B) Zur Überwachung von allen Arten von Räumen,"C) Zur Überwachung von Wänden, Decken und Böden",D) Zur Überwachung einzelner Wertgegenstände,.
"69. Wie können Fenster zusätzlich gesichert werden, um das Eindringen zu erschweren?",A) Durch Anbringen von innen verschraubter Fenstergitter,B) Durch eine Einbruchmeldeanlage,C) Durch Aufkleben von durchwurfhemmenden Sicherheitsfolien,D) Durch eine Videoüberwachungsanlage,.
70. Welche Löschtaktik ist zur Bekämpfung von Tropf- und Fließbränden geeignet?,A) Löschen mit einem Wasservollstrahl,B) Löschen von unten nach oben zur Brennstoffquelle hin,C) Löschen von oben nach unten zum Brandherd hin,"D) Nacheinander mit mehreren Handfeuerlöschern löschen, um Löschreserven zu bilden",.
"71. Was bedeutet der „Duplex-Betrieb"" beim Funkbetrieb?",A) Die Datenübertragung ist nur in eine Richtung möglich,B) Die Datenübertragung ist nur abwechselnd in beide Richtungen einer Telekommunikationsverbindung möglich,C) Die Datenübertragung ist gleichzeitig in beide Richtungen einer Telekommunikationsverbindung möglich,D) Die Datenübertragung ist nur zwischen zwei ortsfesten Funkstellen möglich,.
72. Welche Aussagen treffen auf den Betrieb einer Betriebsfunkanlage zu?,A) Dienstleistungsunternehmen wie Bewachungsunternehmen benötigen für den Betrieb einer Betriebsfunkanlage keine Genehmigung,B) Für den Betrieb einer Betriebsfunkanlage ist die Zuteilung einer Frequenz durch die Bundesnetzagentur erforderlich,"C) Der Betriebsfunk ist eine Sammelbezeichnung für Funkanwendungen, die unter der Bezeichnung „nichtöffentlicher mobiler Landfunk"" erfasst werden",D) Der Betrieb einer Betriebsfunkanlage wird dem Amateursfunkdienst zugeordnet,.